<?xml version="1.0" encoding="UTF-8"?>
<bertha:experiment xmlns:xsi="http://www.w3.org/2001/XMLSchema-instance"
    xsi:schemaLocation="http://med.kuleuven.be/exporl/bertha/1.0/experiment ../schema/experiment.xsd"
    xmlns:bertha="http://med.kuleuven.be/exporl/bertha/1.0/experiment">
    <blocks>
        <block id="wiener">
            <plugin>WienerFilter</plugin>
            <parameter name="filePath">../testdata/GHB_0_5s_filter.bin</parameter>
        </block>
    </blocks>
    <connections>
        <connection>
            <from id="device1" port="capture-1"/>
            <to id="wiener" port="input-1"/>
        </connection>
        <connection>
            <from id="device1" port="capture-2"/>
            <to id="wiener" port="input-2"/>
        </connection>
        <connection>
            <from id="wiener" port="output-1"/>
            <to id="device1" port="playback-1"/>
        </connection>
        <connection>
            <from id="wiener" port="output-2"/>
            <to id="device1" port="playback-2"/>
        </connection>
    </connections>
    <device id="device1">
        <driver>Files</driver>
        <samplerate>16000</samplerate>
        <blocksize>8192</blocksize>
        <playbackports>2</playbackports>
        <captureports>2</captureports>
        <parameter name="inputFiles">../testdata/hrtf_signalnoisecombined_ch1.wav,../testdata/hrtf_signalnoisecombined_ch2.wav</parameter>
        <parameter name="outputFiles">../testdata/output_ch1.wav,../testdata/output_ch2.wav</parameter>
    </device>
</bertha:experiment>
