<?xml version="1.0" encoding="UTF-8"?>
<bertha:experiment xmlns:xsi="http://www.w3.org/2001/XMLSchema-instance"
    xsi:schemaLocation="http://med.kuleuven.be/exporl/bertha/1.0/experiment ../schema/experiment.xsd"
    xmlns:bertha="http://med.kuleuven.be/exporl/bertha/1.0/experiment">
    <blocks>
        <block id="sineblock1">
            <plugin>SineGenerator</plugin>
            <parameter name="frequency">1000</parameter>
            <parameter name="amplitude">0.2</parameter>
            <parameter name="phase">0</parameter>
        </block>
        <block id="sineblock2">
            <plugin>SineGenerator</plugin>
            <parameter name="frequency">50</parameter>
            <parameter name="amplitude">0.2</parameter>
            <parameter name="phase">0</parameter>
        </block>
        <block id="rectificationblock">
            <plugin>Rectification</plugin>
        </block>
        <block id="multiplierblock">
            <plugin>Multiplier</plugin>
            <inputports>2</inputports>
        </block>
    </blocks>
    <connections>
        <connection>
            <from id="sineblock1" port="output-1"/>
            <to id="multiplierblock" port="input-1"/>
        </connection>
        <connection>
            <from id="sineblock2" port="output-1"/>
            <to id="rectificationblock" port="input-1"/>
        </connection>
        <connection>
            <from id="rectificationblock" port="output-1"/>
            <to id="multiplierblock" port="input-2"/>
        </connection>
        <connection>
            <from id="multiplierblock" port="output-1"/>
            <to id="device" port="playback-1"/>
        </connection>
    </connections>
    <device id="device">
        <driver>File</driver>
        <samplerate>44100</samplerate>
        <blocksize>44100</blocksize>
        <playbackports>1</playbackports>
        <captureports>0</captureports>
        <parameter name="outputFile">OUTPUTFILEPLACEHOLDER</parameter>
    </device>
</bertha:experiment>
