<?xml version="1.0" encoding="UTF-8"?>
<bertha:experiment xmlns:xsi="http://www.w3.org/2001/XMLSchema-instance"
    xsi:schemaLocation="http://med.kuleuven.be/exporl/bertha/1.0/experiment ../schema/experiment.xsd"
    xmlns:bertha="http://med.kuleuven.be/exporl/bertha/1.0/experiment">
    <blocks>
        <block id="fft">
            <plugin>Fft</plugin>
        </block>
        <block id="ifft">
            <plugin>Ifft</plugin>
        </block>
    </blocks>
    <connections>
        <connection>
            <from id="device" port="capture-1"/>
            <to id="fft" port="input-1"/>
        </connection>
        <connection>
            <from id="fft" port="output-1"/>
            <to id="ifft" port="input-1"/>
        </connection>
        <connection>
            <from id="ifft" port="output-1"/>
            <to id="device" port="playback-1"/>
        </connection>
    </connections>
    <device id="device">
        <driver>File</driver>
        <samplerate>44100</samplerate>
        <blocksize>441</blocksize>
        <playbackports>1</playbackports>
        <captureports>1</captureports>
        <parameter name="inputFile">INPUTFILEPLACEHOLDER</parameter>
        <parameter name="outputFile">OUTPUTFILEPLACEHOLDER</parameter>
    </device>
</bertha:experiment>
