<?xml version="1.0" encoding="UTF-8"?>
<bertha:experiment xmlns:xsi="http://www.w3.org/2001/XMLSchema-instance"
    xsi:schemaLocation="http://med.kuleuven.be/exporl/bertha/1.0/experiment ../schema/experiment.xsd"
    xmlns:bertha="http://med.kuleuven.be/exporl/bertha/1.0/experiment">
    <blocks>
        <block id="block">
            <plugin>FileSink</plugin>
            <parameter name="filePath">../testdata/output_ch1.wav</parameter>
            <parameter name="format">pcm16</parameter>
        </block>
    </blocks>
    <connections>
        <connection>
            <from id="device" port="capture-1"/>
            <to id="block" port="input-1"/>
        </connection>
        <connection>
            <from id="block" port="output-1"/>
            <to id="device" port="playback-1"/>
        </connection>
    </connections>
    <device id="device">
        <driver>Files</driver>
        <samplerate>16000</samplerate>
        <blocksize>8192</blocksize>
        <playbackports>1</playbackports>
        <captureports>1</captureports>
        <parameter name="inputFiles">../testdata/man001.wav</parameter>
        <parameter name="outputFiles">../testdata/output.wav</parameter>
    </device>
</bertha:experiment>

